{
  "title": "When is Multi-task Learning Beneficial for Low-Resource Noisy Code-switched User-generated Algerian Texts?",
  "authors": [
    "Wafia Adouane",
    "Jean-Philippe Bernardy"
  ],
  "year": 2020,
  "venue": "Workshop on Computational Approaches to Linguistic Code-Switching (CALCS)",
  "publication_type": "empirical study",
  "problem_statement": "Scarcity of annotated morpho-syntactic and semantic training data poses substantial challenges for natural language processing in low-resource, non-standardized, code-switched languages. The authors investigate the specific conditions under which multi-task learning with shared representations is beneficial or detrimental for noisy user-generated Algerian Arabic across sequence tagging, sequence-to-sequence, and text classification tasks.",
  "domain": "Natural Language Processing (NLP), Low-Resource Colloquial Languages, Code-Switching (specifically Algerian Arabic / ALG user-generated social media text with Berber, French, English, and Modern Standard Arabic)",
  "theoretical_framework": "Multi-task representation learning theory (Caruana, 1997), which posits that joint learning of complementary tasks induces shared generalizable representations, contextualized within sociolinguistic frameworks of multilingual code-switching and diglossia in North Africa.",
  "methodology": "The authors implement an end-to-end multi-task neural network consisting of shared convolutional encoders and task-specific decoders. The token-level encoder uses two CNN layers (100 features, filter size 5, dropout 0.2, max pooling) mapping characters to token representations. The sequence-level encoder applies two CNN layers (200 and 100 features, filter size 3, dropout 0.05) to output sentence representations. Task heads include: (1) CSD sequence-tagging dense softmax layer across 9 classes, (2) NER sequence-tagging dense softmax layer across 6 classes with IOB tagging, (3) SPELL sequence-to-sequence 1-layer LSTM decoder (100 units, dropout 0.1) followed by a dense layer, and (4) SA classification dense softmax layer across 4 sentiment classes. Models are trained using the Adam optimizer (batch size 64, gradient clipping norm 5) by alternating tasks per full epoch. Empirical experiments evaluate pairwise task combinations, task ordering (3-task and 4-task permutations), word context effects (token-level vs. sequence-level SPELL), SPELL training dataset sizing (10k, 50k, 100k, full), and data augmentation (combining token and sequence inputs).",
  "datasets": [
    "Code-Switch Detection (CSD) Dataset: 10,590 user-generated texts (223,541 tokens) annotated token-level across 9 classes (ALG, MSA, FRC, BOR, NER, DIG, SND, ENG, BER) (Adouane & Dobnik, 2017).",
    "Spelling Normalisation and Correction (SPELL) Dataset: Parallel corpus of 185,219 samples (50,456 words, 26,199 types) for non-standardized orthographic normalization (Adouane et al., 2019).",
    "Sentiment Analysis (SA) Dataset: 36,120 user-generated comments annotated for 4 sentiment classes (POS, NEG, NEU, MIX) (Adouane et al., 2020).",
    "Named Entity Recognition (NER) Dataset: Newly compiled corpus of 46,710 user-generated comments (17,133 entity mentions) annotated with OntoNotes 5.0 IOB labels across 6 classes (PER, LOC, PRO, ORG, COM, OTH) and non-entity (OOO)."
  ],
  "evaluation": {
    "metrics": [
      "Accuracy (%)",
      "Macro F-score",
      "Micro F-score (per-class convergence analysis)"
    ],
    "baseline_vs_pairwise_results": {
      "CSD": {
        "single_task": {
          "accuracy": 96.80,
          "macro_f1": 64.54
        },
        "CSD_plus_NER": {
          "accuracy": 97.20,
          "macro_f1": 71.29
        },
        "CSD_plus_SPELL": {
          "accuracy": 96.32,
          "macro_f1": 62.27
        },
        "CSD_plus_SA": {
          "accuracy": 94.30,
          "macro_f1": 34.61
        }
      },
      "SPELL": {
        "single_task": {
          "accuracy": 93.49
        },
        "SPELL_plus_NER": {
          "accuracy": 93.71
        },
        "SPELL_plus_CSD": {
          "accuracy": 93.60
        },
        "SPELL_plus_SA": {
          "accuracy": 93.20
        }
      },
      "SA": {
        "single_task": {
          "accuracy": 61.23,
          "macro_f1": 54.08
        },
        "SA_plus_CSD": {
          "accuracy": 61.35,
          "macro_f1": 53.31
        },
        "SA_plus_SPELL": {
          "accuracy": 60.74,
          "macro_f1": 51.50
        },
        "SA_plus_NER": {
          "accuracy": 59.82,
          "macro_f1": 53.46
        }
      },
      "NER": {
        "single_task": {
          "accuracy": 99.80,
          "macro_f1": 49.68
        },
        "NER_plus_CSD": {
          "accuracy": 99.82,
          "macro_f1": 48.65
        },
        "NER_plus_SPELL": {
          "accuracy": 99.78,
          "macro_f1": 42.05
        },
        "NER_plus_SA": {
          "accuracy": 99.74,
          "macro_f1": 34.60
        }
      }
    }
  },
  "key_findings": [
    "Multi-task learning is not universally beneficial for low-resource code-switched text; benefits depend heavily on task compatibility, task order, dataset size, and data noise.",
    "Jointly training CSD and NER provides mutual performance improvements, elevating CSD accuracy to 97.20% and macro F1 to 71.29% while improving minority classes such as English tokens and Named Entity mentions.",
    "Joint training with SPELL or SA degrades performance on CSD and NER due to severe orthographic sparsity and noise present in user-generated spelling and sentiment datasets.",
    "Multi-task learning accelerates learning speed in the first 1 to 7 epochs, but performance often plateaus or degrades over extended training compared to single-task baselines.",
    "Task execution order strongly influences early training dynamics in 3-task and 4-task configurations, with NER+CSD+SPELL+SA and SPELL+CSD+NER+SA optimizing SPELL performance.",
    "Sentence-level word context is essential for sequence-to-sequence spelling correction; omitting context reduces both SPELL accuracy and multi-task transfer effectiveness.",
    "Increasing auxiliary dataset size for SPELL yields diminishing returns in multi-task configurations; transfer gains peak at 10k samples for SA/NER and 100k samples for CSD rather than scaling monotonically with data size.",
    "Data augmentation (combining token-level and sequence-level inputs for SPELL) improves single-task SPELL accuracy but offers negligible gain at convergence in multi-task settings."
  ],
  "scope_and_delimitations": [
    "The study focuses exclusively on Algerian Arabic (ALG) user-generated text from social media platforms, characterized by multilingual code-switching and unstandardized orthography.",
    "The experimental evaluation is restricted to four specific tasks: Code-Switch Detection, Named Entity Recognition, Spelling Normalisation/Correction, and Sentiment Analysis.",
    "The neural architecture relies on convolutional character and token encoders with LSTM/dense decoders, without utilizing large pre-trained multilingual transformers.",
    "Evaluation is capped at 50 epochs for pairwise experiments and 20 epochs for 3-task and 4-task configurations."
  ],
  "limitations": {
    "verbatim_excerpt": "Other tasks benefit from jointly learning them with some other tasks but the gain is only during the first few epochs, especially for tasks with little training data (CSD, NER and SA comparably to SPELL). Training for more epochs degraded their performance compared to learning them separately which is likely caused by the noisiness and sparsity of the data. This means that it is hard to say whether multi-tasking is useful or not without mentioning several factors such as the tasks themselves, their order, the size of their datasets.",
    "summary": "The authors identify that multi-task learning improvements are frequently transient and confined to initial training epochs before degrading due to dataset noise and sparsity. Furthermore, substantial class and dataset size imbalances exist, and multi-task efficacy remains highly sensitive to task selection and task ordering."
  },
  "generalizability_gap": "The empirical findings are established specifically on Algerian Arabic code-switched social media text. The generalizability of these multi-task dynamics to other low-resource dialectal Arabic varieties, non-Arabic code-switched language pairs, formal linguistic domains, or standardized text remains unverified.",
  "methodological_gap": "The framework utilizes a fixed CNN-based encoder architecture with alternating whole-epoch training, omitting exploration of dynamic loss-balancing strategies (e.g., GradNorm, uncertainty weighting), soft parameter sharing mechanisms, or pretrained transformer backbones.",
  "future_work": [
    "Examine noise and sparsity hypotheses using sequential transfer learning, such as applying SPELL normalization across all datasets prior to downstream task training.",
    "Explore curriculum learning strategies on both tasks and individual classes by introducing tasks and classes in increasing order of difficulty.",
    "Investigate advanced multi-task loss balancing and optimization techniques to prevent negative transfer during extended training."
  ]
}
